viewCount,likeCount,dislikeCount,favoriteCount,commentCount,title,publishedAt,playlist_anme493515,24877,924,0,1703,"Лоуренс Краусс о Трампе и Путине, СССР, темной энергии, образовании и теологии",2017-06-30T00:21:51Z,В гостях у SciOne. Большие интервью
331780,19858,390,0,1508,"Ричард Докинз о нелюбимом меме, мучениках атеизма, правильной теологии и разговоре с богом",2017-07-16T17:43:40Z,В гостях у SciOne. Большие интервью
112800,7060,88,0,321,"Джеймс Уотсон: Сегодня надо быть умнее, чем 100 лет назад",2017-09-20T20:35:47Z,В гостях у SciOne. Большие интервью
79413,5071,132,0,363,"Майкл Шермер о верующих, косплеерах, борьбе с мракобесием и счастье скептика",2018-05-17T10:42:52Z,В гостях у SciOne. Большие интервью
42625,3513,60,0,346,"«Плутон — это планета, смиритесь». Глава миссии «Новые Горизонты» Алан Стерн | Большое интервью",2019-02-28T09:01:05Z,В гостях у SciOne. Большие интервью
35733,1000,8,0,35,Интервью с Мэттом Тейлором,2015-11-03T20:17:11Z,В гостях у SciOne. Большие интервью
26596,2060,57,0,159,Киборг из Лондона о новой жизни с технологиями,2018-02-21T15:53:24Z,В гостях у SciOne. Большие интервью
17417,634,4,0,29,"Человек, который покорил комету. Интервью с Мэттом Тейлором",2015-10-24T00:43:08Z,В гостях у SciOne. Большие интервью
Private video,2017-10-14T11:13:08Z,В гостях у SciOne. Большие интервью
18757,351,31,0,19,Medicinal Chemistry 4ever,2015-07-27T15:14:47Z,Для конкурсов
